imgstem_version,texts,text_controls,clipscore
27204,Sharen'go cars at Piazza Duca d'Aosta,Sharen'go cars at Piazza Duca d'Aosta,0.82080078125
57501,"""The Mirror of Death"": Detail from a French Renaissance monument of 1547","""The Mirror of Death"": Detail from a French Renaissance monument of 1547",0.70263671875
40717,"Kakkar at the premiere event of Marathi film Janiva, 2015","Kakkar at the premiere event of Marathi film Janiva, 2015",0.8505859375
89222,"HKFO performs a ""Ode to Joy"" flashmob at Shatin New Town Plaza.","HKFO performs a ""Ode to Joy"" flashmob at Shatin New Town Plaza.",0.740234375
4042,Singapore Airlines serves as the flag carrier of the country.,Singapore Airlines serves as the flag carrier of the country.,0.81787109375
24223,Justine Henin is a four-time champion and won three times consecutively.,Justine Henin is a four-time champion and won three times consecutively.,0.8271484375
79549,Holt Brothers Banking Company Building,Holt Brothers Banking Company Building,0.71728515625
86794,"Porter Wagoner topped the chart with ""Misery Loves Company"".","Porter Wagoner topped the chart with ""Misery Loves Company"".",0.88818359375
30909, 360-degree panorama from the summit of Ruby Dome, 360-degree panorama from the summit of Ruby Dome,0.775390625
94250,"Stanisaw Koniecpolski, 17th century","Stanisaw Koniecpolski, 17th century",0.82568359375
13651,USS Texas,USS Texas,0.7109375
72251,Map emphasizing the Ebro River in northern Spain,Map emphasizing the Ebro River in northern Spain,0.73974609375
69800,Memorial marker,Memorial marker,0.775390625
26795,"The original theatrical release of Return of the Jedi features Sebastian Shaw as Anakin Skywalker (above left). The 2004 DVD release replaced his appearance as a Force spirit with Hayden Christensen (below), who played the character in the prequels.","The original theatrical release of Return of the Jedi features Sebastian Shaw as Anakin Skywalker (above left). The 2004 DVD release replaced his appearance as a Force spirit with Hayden Christensen (below), who played the character in the prequels.",0.86181640625
34757,"30 Rockefeller Plaza, where Man at the Crossroads was originally installed","30 Rockefeller Plaza, where Man at the Crossroads was originally installed",0.8330078125
18004,Poppies are a recurring theme on the album's artwork.,Poppies are a recurring theme on the album's artwork.,0.759765625
86080,"Chteau of the popes, early 16th century engraving","Chteau of the popes, early 16th century engraving",0.6923828125
2630,"The Ladies of Llangollen, Eleanor Butler and Sarah Ponsonby.The two women had a relationship that was hailed as devoted and virtuous, after eloping and living 51 years together in Wales.","The Ladies of Llangollen, Eleanor Butler and Sarah Ponsonby.The two women had a relationship that was hailed as devoted and virtuous, after eloping and living 51 years together in Wales.",0.58056640625
11005,Map showing monasteries and bishoprics in Northumbria around 670. Bishoprics are underlined.,Map showing monasteries and bishoprics in Northumbria around 670. Bishoprics are underlined.,0.802734375
10656,"Sunrise over Oquirrh Lake, March 2008","Sunrise over Oquirrh Lake, March 2008",0.7646484375
54601,David Warner was player of the tournament in the 201516 series in Australia.,David Warner was player of the tournament in the 201516 series in Australia.,0.7060546875
15702,Octopus card reader of a self-payment kiosk at a McDonald's restaurant in Hong Kong,Octopus card reader of a self-payment kiosk at a McDonald's restaurant in Hong Kong,0.93359375
65349,BEdita: a screenshot of the dashboard,BEdita: a screenshot of the dashboard,0.60498046875
91452, Partial panorama from the cliffs just northwest of the summit of Stony Man Mountain, Partial panorama from the cliffs just northwest of the summit of Stony Man Mountain,0.724609375
12577,Alley in Richmond,Alley in Richmond,0.75146484375
20828,"The five finalists selected by the commission on August 18, 2020","The five finalists selected by the commission on August 18, 2020",0.62109375
85450,Sara (left) and Jim (right) riding It's a Small World,Sara (left) and Jim (right) riding It's a Small World,0.58935546875
78869,"Alison Lundergan Grimes (second from right) appearing at the 2016 Politicon at the Pasadena Convention Center in Pasadena, California.","Alison Lundergan Grimes (second from right) appearing at the 2016 Politicon at the Pasadena Convention Center in Pasadena, California.",0.88330078125
